{
  "$schema": "https://json-schema.org/draft/2020-12/schema",
  "$id": "https://spec.aixin.io/schemas/intent.schema.json",
  "title": "AiXin Intent Signal",
  "type": "object",
  "additionalProperties": false,
  "required": ["action"],
  "properties": {
    "action":     { "type": "string", "minLength": 1 },
    "specialist": { "type": "string" },
    "skill":      { "type": "string" },
    "params":     { "type": "object" },
    "amount":     { "type": "number", "exclusiveMinimum": 0 },
    "currency":   { "type": "string", "pattern": "^[A-Z]{3}$" }
  }
}
